{
  "schema_version": "0.3",
  "tool_id": "tool_orbit_dataset_query_watchlist",
  "version": "0.1.0-synthetic",
  "display_name": "Dataset Query and Watchlist Tool",
  "description": "Reads immutable Dataset Registry revisions and synthetic Watchlist snapshots or diffs without downloading assets or changing Registry state.",
  "owner": {
    "human_id": "hum_technology_data_owner_syn",
    "role": "Technology Data Owner"
  },
  "status": "evaluation",
  "hierarchy_scope_refs": ["hnode_technology_dataset_acquisition_syn"],
  "operations": [
    {
      "operation_id": "query_registry_watchlist",
      "description": "Return logical dataset, snapshot, and diff references from a fixed Registry revision.",
      "action_types": ["read"],
      "risk_class": "low",
      "input_schema_ref": "urn:orbit:data-asset:dataset-registry-query-request:0.1",
      "output_schema_ref": "urn:orbit:data-asset:dataset-registry-query-result:0.1",
      "side_effect": "none",
      "idempotency": "required",
      "approval": { "mode": "none", "policy_ref": "policy://dataset-query/read-only" },
      "credential_policy": { "credential_ref": "credential://none", "delivery": "workload_identity", "agent_visible": false },
      "network_egress": { "mode": "deny_all", "destination_refs": [] },
      "data_policy": {
        "allowed_classifications": ["public"],
        "allowed_security_zones": ["medical_research"],
        "output_classification": "public"
      },
      "timeout_seconds": 30
    }
  ],
  "runtime_constraints": {
    "allowed_environments": ["test", "staging"],
    "sandbox_required": true
  },
  "audit_policy": {
    "record_request": true,
    "record_decision": true,
    "record_receipt": true,
    "content_logging": "metadata_only",
    "retention_policy_ref": "retention://dataset-tools/d0-synthetic"
  },
  "created_at": "2026-08-25T11:15:00Z",
  "updated_at": "2026-08-25T11:15:00Z"
}

