{"audit_policy":{"content_logging":"metadata_only","record_decision":true,"record_receipt":true,"record_request":true,"retention_policy_ref":"retention://dataset-tools/d0-synthetic"},"created_at":"2026-08-25T11:15:00Z","description":"Fixed offline delivery tool; no production permission.","display_name":"retrieve_evidence","hierarchy_scope_refs":["hnode_technology_dataset_acquisition_syn"],"operations":[{"action_types":["read"],"approval":{"mode":"none","policy_ref":"policy://dataset-query/read-only"},"credential_policy":{"agent_visible":false,"credential_ref":"credential://none","delivery":"workload_identity"},"data_policy":{"allowed_classifications":["public"],"allowed_security_zones":["medical_research"],"output_classification":"public"},"description":"Execute fixed local document or acceptance operation.","idempotency":"required","input_schema_ref":"urn:orbit:data-asset:delivery-retrieve-evidence-input:0.1","network_egress":{"destination_refs":[],"mode":"deny_all"},"operation_id":"retrieve_evidence","output_schema_ref":"urn:orbit:data-asset:delivery-retrieve-evidence-output:0.1","risk_class":"low","side_effect":"none","timeout_seconds":30}],"owner":{"human_id":"hum_technology_data_owner_syn","role":"Technology Data Owner"},"runtime_constraints":{"allowed_environments":["test","staging"],"sandbox_required":true},"schema_version":"0.3","status":"evaluation","tool_id":"tool_orbit_delivery_retrieve_evidence","updated_at":"2026-08-25T11:15:00Z","version":"0.1.0-synthetic"}